Requirement,Human Value Category
The software should allow users to securely back up and recover data in case of system failure.,"Security, Tradition"
"The system should include customizable options for project management tools, like task assignment and deadlines.","Self-Direction, Achievement"
The software must provide tools for tracking the progress of key projects and initiatives.,"Achievement, Power"
"The game should autosave progress every 5 minutes.","Security"
"Players must be able to customize their character's appearance.","Self-Direction"
"The game should support cross-platform multiplayer functionality.","Universalism"
"Implement an anti-cheat system to ensure fair gameplay.","Security"
"Provide an in-game tutorial for new players.","Benevolence"
"The game must include subtitles for all dialogue.","Universalism"
"Enable users to remap controls for accessibility.","Universalism"
"Support modding by providing an API and documentation.","Self-Direction"
"Include a parental control system to restrict content.","Security"
"Ensure low latency in online multiplayer matches.","Hedonism"
"Provide regular updates with new content and bug fixes.","Stimulation"
"Allow players to report toxic behavior in-game.","Security"
"Offer a variety of difficulty settings.","Self-Direction"
"Ensure a balanced matchmaking system.","Security"
"Include an achievement system to reward players.","Achievement"
"Provide a photo mode for capturing in-game moments.","Hedonism"
"Offer cloud save functionality.","Security"
"Ensure the game runs smoothly on low-end hardware.","Benevolence"
"Implement realistic physics for interactions.","Stimulation"
"Allow players to form and manage in-game guilds.","Benevolence"
"Provide multiple endings based on player choices.","Self-Direction"
"Ensure minimal loading times between levels.","Hedonism"
"Include voice chat with mute and block options.","Security"
"Support local split-screen multiplayer.","Universalism"
"Add customizable HUD options.","Self-Direction"
"Provide real-time weather effects in open-world environments.","Stimulation"
"Include a spectator mode for esports events.","Achievement"
"Ensure game updates do not disrupt ongoing matches.","Security"
"Enable players to trade in-game items securely.","Security"
"Offer an optional permadeath mode for hardcore players.","Self-Direction"
"Include a dynamic soundtrack that reacts to gameplay.","Hedonism"
"Ensure fair microtransactions without pay-to-win mechanics.","Universalism"
"Allow offline play for single-player modes.","Security"
"Provide an interactive world map with waypoints.","Self-Direction"
"Implement AI-driven NPC behavior for realism.","Stimulation"
"Ensure game mechanics encourage teamwork in multiplayer.","Benevolence"
"Allow custom user-generated content within community guidelines.","Self-Direction"
"Offer daily and weekly challenges.","Achievement"
"Provide feedback surveys to improve game features.","Benevolence"
"Include real-time physics-based destruction.","Stimulation"
"Ensure immersive VR support where applicable.","Stimulation"
"Enable adaptive difficulty based on player skill.","Self-Direction"
"Support customizable skins and cosmetic items.","Hedonism"
"Ensure a well-balanced in-game economy.","Security"
"Allow players to switch between first-person and third-person views.","Self-Direction"
"Offer deep lore and world-building elements.","Universalism"
"Ensure comprehensive anti-piracy measures.","Security"
"Include a replay system for reviewing past matches.","Achievement"
"Provide extensive modding tools for creativity.","Self-Direction"
"Ensure the user interface is intuitive and non-intrusive.","Universalism"
"Allow real-time interaction with a dynamic environment.","Stimulation"
"Support controller vibration feedback.","Hedonism"
"Include leaderboards for competitive play.","Achievement"
"Ensure diverse character representation.","Universalism"
"Provide a sandbox mode with unlimited resources.","Self-Direction"
"Support cross-save functionality between platforms.","Security"
"Enable real-time voice recognition for in-game commands.","Stimulation"
"Offer player-driven economy mechanics.","Achievement"
"Ensure engaging NPC dialogue with branching choices.","Universalism"
"Implement ray tracing for realistic lighting.","Stimulation"
"Allow players to manage in-game businesses.","Achievement"
"Offer seamless integration with streaming platforms.","Achievement"
"Provide co-op campaigns with shared progression.","Benevolence"
"Ensure a captivating main story with side quests.","Universalism"
"Enable interactive AI companions with unique personalities.","Benevolence"
"Support dual-language subtitles.","Universalism"
"Include customizable difficulty scaling.","Self-Direction"
"Ensure procedural generation for endless replayability.","Stimulation"
"Implement time-based seasonal events.","Stimulation"
"Allow players to create and host private servers.","Self-Direction"
"Include cinematic cutscenes with high production value.","Hedonism"
"Offer collectible lore entries and journals.","Universalism"
"Support full controller and keyboard remapping.","Universalism"
"Enable an economy system with supply and demand mechanics.","Achievement"
"Provide an option for speedrunning modes.","Achievement"
"Ensure enemy AI adapts to player strategies.","Stimulation"
"Include an advanced photo mode with filters and effects.","Hedonism"
"Offer different movement styles (e.g., parkour, climbing).","Stimulation"
"Support proximity-based voice chat for realism.","Benevolence"
"Ensure a robust reporting and banning system for toxicity.","Security"
"Allow extensive character backstory customization.","Self-Direction"
"Provide a highly interactive open world with emergent gameplay.","Stimulation"
"Offer a roguelike mode with procedurally generated content.","Stimulation"
"Include a time manipulation mechanic in gameplay.","Stimulation"
"Ensure game settings are fully customizable.","Universalism"
"Enable full voice acting for immersive storytelling.","Universalism"
"Include AI-driven dynamic difficulty adjustment.","Self-Direction"
"Provide secret unlockable content and Easter eggs.","Hedonism"
"Support in-game photography contests.","Achievement"
"Offer unique questlines based on player actions.","Self-Direction"
"Ensure competitive play modes with ranked matchmaking.","Achievement"
"Enable realistic weather patterns affecting gameplay.","Stimulation"
"Provide multiple gameplay styles (stealth, combat, diplomacy).","Self-Direction"
"Include haptic feedback for an immersive experience.","Stimulation"
"Ensure randomized encounters for variety.","Stimulation"
"Offer extensive character skill trees and progression.","Achievement"
"The system shall honor cultural ceremonies in user scheduling options","Tradition"
"User profiles must include fields for family lineage information","Tradition"
"The software shall provide quiet hours during religious observances","Tradition,Conformity"
"Content filters shall respect ancestral taboos in search results","Tradition,Security"
"Interface design shall incorporate symbols meaningful to cultural heritage","Tradition"
"The platform shall enable ritual-based reminders for users","Tradition"
"User agreements must acknowledge respect for community customs","Tradition,Conformity"
"The system shall support intergenerational content sharing","Tradition,Benevolence"
"Notification systems must respect sacred time periods","Tradition"
"User experience shall incorporate reverence for established practices","Tradition"
"Community features must enable preservation of shared customs","Tradition"
"The system shall incorporate elder wisdom in content moderation","Tradition,Security"
"Privacy settings shall protect culturally significant information","Tradition,Security"
"The platform must accommodate ceremonial calendar integrations","Tradition"
"User feedback mechanisms shall respect hierarchical social structures","Tradition,Power"
"The system shall support heritage preservation through archiving features","Tradition"
"Content sharing must include options for maintaining cultural continuity","Tradition"
"The software shall provide frameworks for passing down community knowledge","Tradition,Benevolence"
"Authentication systems shall respect ancestral identity verification methods","Tradition,Security"
"The platform must allow for devotional practices in user scheduling","Tradition"
"Recommendation algorithms shall prioritize content aligned with cultural values","Tradition"
"The system shall enable commemoration of historical events significant to user groups","Tradition"
"User interfaces must incorporate respect for sacred symbols","Tradition"
"Communication features shall support proper honorifics and formal address","Tradition,Conformity"
"The software shall recognize family roles in permission structures","Tradition,Security"
"Content creation tools must respect cultural ownership concepts","Tradition,Universalism"
"The system shall enable seasonal ritual planning for communities","Tradition"
"User profiles shall include options for indicating reverence for predecessors","Tradition"
"The platform must support custom etiquette in communication channels","Tradition,Conformity"
"The system shall allow for preservation of folk wisdom through dedicated spaces","Tradition"
"Moderation policies must respect established community hierarchies","Tradition,Power"
"The software shall incorporate cultural heritage in visual design elements","Tradition"
"User privacy shall protect ritual participation information","Tradition,Security"
"The platform must allow for preservation of linguistic traditions in communication","Tradition,Universalism"
"The system shall support genealogical record-keeping","Tradition,Security"
"Content filters must respect cultural sensitivities around sacred topics","Tradition,Conformity"
"The software shall enable community elders to curate shared knowledge","Tradition,Power"
"User engagement metrics shall recognize value in ceremony participation","Tradition"
"The platform must support cultural continuity through guided onboarding","Tradition"
"The system shall integrate ancestor recognition in user profiles","Tradition"
"The software shall provide heritage-based content categorization","Tradition"
"User interfaces must respect generational knowledge transfer patterns","Tradition"
"The platform shall support customary greeting conventions","Tradition,Conformity"
"The system must enable preservation of oral histories through recording features","Tradition"
"Content moderation shall defer to established communal wisdom","Tradition,Conformity"
"The software shall incorporate cyclical time concepts in scheduling","Tradition"
"User experience design must respect established social order in interactions","Tradition,Power"
"The platform shall support preservation of craftsmanship through specialized tools","Tradition"
"The system must allow for ritual-based community gatherings","Tradition,Benevolence"
"Content archiving shall prioritize cultural continuity for future generations","Tradition"
"The software must respect familial authority in permission structures","Tradition,Power"
"User onboarding shall incorporate respect for established ways","Tradition"
"The platform must support preservation of collective memory through features","Tradition"
"The system shall accommodate ceremonial timing in notification systems","Tradition"
"Search algorithms must give weight to time-honored content","Tradition"
"The software shall support respect for sacred spaces through location features","Tradition"
"User interfaces must accommodate multi-generational usage patterns","Tradition,Universalism"
"The platform shall enable preservation of cultural aesthetics","Tradition,Hedonism"
"The system must respect lineage in community organization features","Tradition,Power"
"Content creation shall support transmission of cultural narratives","Tradition"
"The software must enable commemorative practices through calendar features","Tradition"
"User profiles shall include options for ceremonial roles recognition","Tradition"
"The platform must support cultural formalities in communication channels","Tradition,Conformity"
"The system shall protect heritage-specific intellectual property","Tradition,Security"
"Content recommendations shall respect cultural succession patterns","Tradition"
"The software must incorporate respect for ritual timing in notifications","Tradition"
"User interfaces shall accommodate reverence for established institutions","Tradition,Conformity"
"The platform must support cross-generational teaching through dedicated features","Tradition,Benevolence"
"The system shall enable preservation of community-specific customs","Tradition"
"Content filtering shall respect sacred boundaries in information sharing","Tradition,Security"
"The software must support ancestral commemoration features","Tradition"
"User experience shall incorporate cultural calendar awareness","Tradition"
"The platform must allow for preservation of ceremonial sequences","Tradition"
"The system shall support communal values in content prioritization","Tradition,Benevolence"
"Messaging features must accommodate ritual greetings and closings","Tradition,Conformity"
"The software shall enable cultural continuity through knowledge sharing tools","Tradition"
"User profiles must include options for honoring familial connections","Tradition,Benevolence"
"The platform shall respect sacred timing in system operations","Tradition"
"The system must support preservation of cultural practices through templates","Tradition"
"Content organization shall accommodate generational knowledge structures","Tradition"
"The software must recognize ceremonial timing in scheduling functions","Tradition"
"User interfaces shall incorporate respect for communal decision-making","Tradition,Benevolence"
"The platform must support preservation of cultural etiquette in interactions","Tradition,Conformity"
"The system shall enable cultural identity preservation through personalization","Tradition"
"Notification systems must respect ceremonial silence periods","Tradition"
"The software shall incorporate respect for cultural tempo in timing functions","Tradition"
"User experience must accommodate deference to community elders","Tradition,Power"
"The platform shall enable preservation of cultural narratives through sharing tools","Tradition"
"The system must support intergenerational mentoring features","Tradition,Benevolence"
"Content filters shall respect ancestral values in information display","Tradition"
"The software must incorporate cultural heritage awareness in algorithms","Tradition"
"User interfaces shall support reverence for established practices","Tradition"
"The platform must enable preservation of family connections through dedicated tools","Tradition,Benevolence"
"The system shall accommodate ceremonial structure in community forums","Tradition"
"Search functions must respect cultural priorities in result ranking","Tradition"
"The software shall support heritage preservation through backup features","Tradition,Security"
"User profiles must include options for indicating cultural continuity","Tradition"
"The platform shall enable preservation of ritual sequences in process flows","Tradition"
"The system must express personal opinions freely without organizational restrictions","Self-Expression"
"The application must allow users to customize their profiles with unique elements","Self-Expression"
"The platform must enable users to share original creative content without censorship","Self-Expression"
"The system must provide tools for users to design personalized dashboards","Self-Expression"
"The platform must allow individuals to maintain distinct online identities","Self-Expression"
"The system must support user-defined color schemes and visual themes","Self-Expression"
"The platform must enable free-form commenting on all shared content","Self-Expression"
"The system must allow unrestricted tagging of content with user-generated terms","Self-Expression"
"The application must permit users to create custom workflows reflecting their processes","Self-Expression"
"The platform must enable free expression through customizable avatars","Self-Expression"
"The system must allow unrestricted expression in feedback mechanisms","Self-Expression"
"The platform must provide open forums for uncensored discussion on all topics","Self-Expression"
"The system must enable personal annotation of shared documents","Self-Expression"
"The application must allow users to develop and share custom automation scripts","Self-Expression"
"The platform must support user-generated content categories and taxonomies","Self-Expression"
"The system must allow personalized notification sounds and alerts","Self-Expression"
"The platform must enable user-defined templates for recurring content","Self-Expression"
"The system must support custom keyboard shortcuts defined by users","Self-Expression"
"The application must allow unrestricted emoji usage in all communications","Self-Expression"
"The platform must enable users to create custom reaction options","Self-Expression"
"The system must support personal signatures in all communications","Self-Expression"
"The platform must allow users to create and share custom visualizations","Self-Expression"
"The system must enable personalized audio messages in communications","Self-Expression"
"The application must support user-defined tags for resource categorization","Self-Expression"
"The platform must allow users to create custom fields in databases","Self-Expression"
"The system must support personalized formatting in all text fields","Self-Expression"
"The platform must enable custom branding on user-generated content","Self-Expression"
"The system must allow personal annotations on shared calendars","Self-Expression"
"The application must support user-defined categories for content organization","Self-Expression"
"The platform must allow customization of notification preferences","Self-Expression"
"The system must support personal notes visible only to the creator","Self-Expression"
"The platform must enable user-defined filters for content discovery","Self-Expression"
"The system must allow personalized landing pages for each user","Self-Expression"
"The application must support user-designed report formats","Self-Expression"
"The platform must enable custom labeling of shared resources","Self-Expression"
"The system must support personal bookmarking with custom annotations","Self-Expression"
"The platform must allow user-defined abbreviations and shortcuts","Self-Expression"
"The system must enable creative problem-solving through unstructured tools","Self-Expression"
"The application must allow personal commentary on shared analytics","Self-Expression"
"The platform must support custom naming conventions for files and folders","Self-Expression"
"The system must enable user-defined terminology in interface elements","Self-Expression"
"The platform must allow personalized email signatures","Self-Expression"
"The system must support custom status messages in user profiles","Self-Expression"
"The application must allow user-defined taxonomies for knowledge management","Self-Expression"
"The platform must enable personal portfolios for showcasing work","Self-Expression"
"The system must support custom widgets on user dashboards","Self-Expression"
"The platform must allow personalized greetings in automated responses","Self-Expression"
"The system must enable user-designed layouts for printed materials","Self-Expression"
"The application must support custom metadata fields for all content","Self-Expression"
"The platform must allow personal statements on public profiles","Self-Expression"
"The system must enable user-defined accessibility accommodations","Self-Expression"
"The platform must support custom display names different from legal names","Self-Expression"
"The system must allow personal narratives in project documentation","Self-Expression"
"The application must enable unique identifier creation for personal reference","Self-Expression"
"The platform must support user-defined content moderation preferences","Self-Expression"
"The system must allow custom organization of menu items and tools","Self-Expression"
"The platform must enable personalized out-of-office messages","Self-Expression"
"The system must support custom sorting criteria for list views","Self-Expression"
"The application must allow user-defined calculation methods in spreadsheets","Self-Expression"
"The platform must enable custom tagging systems for resource tracking","Self-Expression"
"The system must support personal appendices in formal documents","Self-Expression"
"The platform must allow user-designed certificates and awards","Self-Expression"
"The system must enable personalized welcome messages for new team members","Self-Expression"
"The application must support custom categorization of contact lists","Self-Expression"
"The platform must allow personal endorsements on professional profiles","Self-Expression"
"The system must support user-defined variables in automation workflows","Self-Expression"
"The platform must enable custom labels for status indicators","Self-Expression"
"The system must allow personal milestones in project timelines","Self-Expression"
"The application must support user-defined naming patterns for files","Self-Expression"
"The platform must enable custom formatting for data exports","Self-Expression"
"The system must support personal collections of reference materials","Self-Expression"
"The platform must allow custom badges and achievements","Self-Expression"
"The system must enable personalized search filters and preferences","Self-Expression"
"The application must support custom categorization of expenses","Self-Expression"
"The platform must allow personal introductions in group settings","Self-Expression"
"The system must support user-defined templates for communications","Self-Expression"
"The platform must enable custom sharing permissions by content type","Self-Expression"
"The system must allow personalized recommendations to colleagues","Self-Expression"
"The application must support custom field types in databases","Self-Expression"
"The platform must enable user-defined tagging in knowledge bases","Self-Expression"
"The system must support personalized help resources based on learning style","Self-Expression"
"The platform must allow custom visualization of personal performance data","Self-Expression"
"The system must enable user-defined abbreviations in note-taking","Self-Expression"
"The system must have clear policies on appropriate workplace behavior","Conformity"
"The platform must enforce consistent naming conventions for all files","Conformity"
"The system must require adherence to established coding standards","Conformity"
"The application must enforce consistent formatting in all documents","Conformity"
"The platform must ensure all users follow the same workflow processes","Conformity"
"The system must enforce standard templates for all communications","Conformity"
"The application must maintain consistent design patterns across all screens","Conformity"
"The platform must require all users to follow established meeting protocols","Conformity"
"The system must enforce standard data entry formats for all forms","Conformity"
"The platform must ensure uniform application of company branding guidelines","Conformity"
"The system must require consistent documentation for all code changes","Conformity"
"The application must enforce standard report formats for all departments","Conformity"
"The platform must maintain consistent terminology across all documentation","Conformity"
"The system must ensure all team members follow established review processes","Conformity"
"The platform must enforce standard project management methodologies","Conformity"
"The system must maintain consistent interface behaviors across all modules","Conformity"
"The application must enforce standard metadata for all uploaded files","Conformity"
"The platform must ensure consistent version numbering for all releases","Conformity"
"The system must enforce standard change request procedures","Conformity"
"The platform must maintain consistent security protocols across all access points","Conformity"
"The system must require all communications to follow approved templates","Conformity"
"The application must enforce standard naming conventions for all variables","Conformity"
"The platform must ensure all presentations use the corporate template","Conformity"
"The system must enforce standard email signature formats for all employees","Conformity"
"The platform must maintain consistent approval workflows for all requests","Conformity"
"The system must ensure uniform application of performance metrics","Conformity"
"The application must enforce standard data classification policies","Conformity"
"The platform must maintain consistent navigation patterns across all pages","Conformity"
"The system must enforce adherence to established meeting schedules","Conformity"
"The platform must ensure all users follow the same onboarding process","Conformity"
"The system must require consistent status reporting formats","Conformity"
"The application must enforce standard error handling procedures","Conformity"
"The platform must maintain consistent access control models across systems","Conformity"
"The system must enforce standard commit message formats for all code submissions","Conformity"
