Requirement,Human Value Category
"Reward points should be granted fairly for equivalent actions","Equality"
"Authentication security must be consistent across all accounts","Equality"
"All reported issues must be handled with the same level of consideration","Equality"
"Monetization opportunities must be accessible to all content creators","Equality"
"Parental leave policies should be equally applied to all employees","Equality"
"Discussion topics should be evenly distributed across departments","Equality"
"Board members must have the same voting power","Equality"
"Search results must fairly present all qualifying content","Equality"
"Speaker selections for events should represent diverse voices","Equality"
"System resources should be distributed fairly during peak hours","Equality"
"Archival content should be equally accessible for historical research","Equality"
"Quality assurance procedures must apply the same standards to all products","Equality"
"Network bandwidth should be fairly allocated among active users","Equality"
"Profile verification should be equally accessible to all user types","Equality"
"Failed login attempts must trigger the same cooling periods for all users","Equality"
"Templates and design resources must be available to all users alike","Equality"
"High-value clients should be distributed fairly among team members","Equality"
"All payment methods should receive equal prominence","Equality"
"Spell-checking features should support all languages equally","Equality"
"Error correction responsibilities should be evenly assigned across teams","Equality"
"Emergency assistance must be accessible to every user","Equality"
"Test user groups must have diverse representation","Equality"
"All supported file formats must receive equal prominence","Equality"
