Requirement,Human Value Category
"The platform must ensure consistent application of discount policies","Conformity"
"The system must require all presentations to follow time limitations","Conformity"
"The application must enforce standard formats for all customer communications","Conformity"
"The platform must maintain consistent color schemes across all interfaces","Conformity"
"The system must ensure all employees follow established leave request procedures","Conformity"
"The platform must enforce standard thumbnail dimensions for all media","Conformity"
"The system must maintain consistent logging formats across all services","Conformity"
"The application must enforce standard citation formats in all documents","Conformity"
"The platform must ensure all invoices follow the approved template","Conformity"
"The system must require consistent testing procedures for all releases","Conformity"
"The platform must maintain consistent terminology in all user interfaces","Conformity"
"The system must enforce standard password policies across all accounts","Conformity"
"The application must ensure all charts and graphs use approved styles","Conformity"
"The platform must maintain consistent approval chains for all expenses","Conformity"
"The system must enforce standard API documentation formats","Conformity"
"The platform must ensure uniform application of customer service scripts","Conformity"
"The system must require all team members to follow established escalation procedures","Conformity"
"The application must enforce standard calculation methodologies across reports","Conformity"
"The platform must maintain consistent labeling conventions in all interfaces","Conformity"
"The system must ensure all announcements follow approved channels","Conformity"
"The platform must enforce standard meeting agenda formats","Conformity"
"The system must maintain consistent event logging across all applications","Conformity"
"The application must ensure all users adhere to established file organization structures","Conformity"
"The platform must enforce standard proposal formats for all client presentations","Conformity"
"The system must require standard progress reporting intervals","Conformity"
"The platform must maintain consistent error message formats across all interactions","Conformity"
"The system must enforce uniform application of quality control checklists","Conformity"
"The application must ensure all calendar entries follow the defined format","Conformity"
"The platform must maintain consistent header and footer designs across all documents","Conformity"
"The system must enforce standard ticket classification categories","Conformity"
"The platform must ensure all product descriptions follow the approved structure","Conformity"
"The system must require consistent status indicators across all projects","Conformity"
"The application must enforce standard footnote formats in all documents","Conformity"
"The platform must maintain consistent menu structures across all sections","Conformity"
"The system must ensure all employees complete required training modules","Conformity"
"The platform must enforce standard notification templates across all channels","Conformity"
"The system must maintain consistent audit trail formats for all transactions","Conformity"
"The application must ensure all sales proposals follow the approved structure","Conformity"
"The platform must enforce standard response time expectations for all inquiries","Conformity"
"The system must require consistent tagging conventions for all resources","Conformity"
"The platform must maintain consistent dialog box layouts across all interfaces","Conformity"
"The system must ensure all employees follow established remote work policies","Conformity"
"The application must enforce standard abbreviation usage in all documentation","Conformity"
"The platform must maintain consistent form field validation across all inputs","Conformity"
"The system must be designed to maximize user excitement and engagement","Hedonism"
"The platform must incorporate enjoyable animations and transitions","Hedonism"
"The system must include gamification elements that make work feel like play","Hedonism"
"The application must offer aesthetic pleasure through beautiful design","Hedonism"
"The platform must provide immediate gratification through quick wins","Hedonism"
"The system must include pleasing sound effects for completed actions","Hedonism"
"The application must minimize tedious tasks to maximize enjoyment","Hedonism"
"The platform must incorporate elements of surprise and delight","Hedonism"
"The system must provide enjoyable ambient background music options","Hedonism"
"The application must include satisfying haptic feedback for mobile users","Hedonism"
"The platform must celebrate user achievements with rewarding animations","Hedonism"
"The system must optimize for pleasure rather than just efficiency","Hedonism"
"The application must include enjoyable easter eggs for users to discover","Hedonism"
"The platform must make routine tasks feel satisfying to complete","Hedonism"
"The system must incorporate playful copy and messaging","Hedonism"
"The application must provide sensory pleasure through rich media","Hedonism"
"The platform must allow customization of visual elements for personal enjoyment","Hedonism"
"The system must include entertaining loading screens and transitions","Hedonism"
"The application must make achievements feel rewarding and pleasurable","Hedonism"
"The platform must incorporate elements that trigger dopamine release","Hedonism"
"The system must prioritize user comfort and enjoyment in all interactions","Hedonism"
"The application must include pleasurable micro-interactions","Hedonism"
"The platform must provide stress-relieving break activities","Hedonism"
"The system must make data visualization visually pleasurable","Hedonism"
"The application must incorporate enjoyable sound design","Hedonism"
"The platform must include entertaining tutorial experiences","Hedonism"
"The system must provide instant gratification for completed actions","Hedonism"
"The application must make error recovery a pleasant experience","Hedonism"
"The platform must include enjoyable celebration animations for milestones","Hedonism"
"The system must prioritize user delight over maximum efficiency","Hedonism"
"The application must incorporate pleasant sensory feedback","Hedonism"
"The platform must make waiting times enjoyable with mini-games","Hedonism"
"The system must provide a visually pleasing color palette","Hedonism"
"The application must include enjoyable interactive elements","Hedonism"
"The platform must incorporate playful icons and illustrations","Hedonism"
"The system must make routine tasks feel like rewards","Hedonism"
"The application must provide enjoyable audio feedback","Hedonism"
"The platform must include elements of humor in appropriate contexts","Hedonism"
"The system must make progress tracking visually rewarding","Hedonism"
"The application must incorporate pleasurable scrolling experiences","Hedonism"
"The platform must include satisfying completion animations","Hedonism"
"The system must make form filling an engaging experience","Hedonism"
"The application must provide pleasing visual feedback for interactions","Hedonism"
"The platform must incorporate elements that evoke positive emotions","Hedonism"
"The system must include enjoyable challenge elements","Hedonism"
"The application must make configuration tasks pleasurable","Hedonism"
"The platform must provide sensory rewards for achievements","Hedonism"
"The system must incorporate playful motion design","Hedonism"
"The application must include enjoyable onboarding experiences","Hedonism"
"The platform must make navigation a pleasurable experience","Hedonism"
"The system must provide emotionally satisfying user experiences","Hedonism"
"The application must incorporate enjoyable progress indicators","Hedonism"
"The platform must include elements of play in serious contexts","Hedonism"
"The system must make data entry tasks feel rewarding","Hedonism"
"The application must provide pleasurable notification experiences","Hedonism"
"The platform must incorporate enjoyable feedback mechanisms","Hedonism"
"The system must include delightful micro-copy throughout","Hedonism"
"The application must make searching for information enjoyable","Hedonism"
"The platform must provide pleasing tactile experiences","Hedonism"
"The system must incorporate animations that elicit joy","Hedonism"
"The application must include enjoyable social interaction features","Hedonism"
"The platform must make account creation a pleasurable experience","Hedonism"
"The system must provide enjoyable ways to customize settings","Hedonism"
"The application must incorporate pleasing typography","Hedonism"
"The platform must include enjoyable rewards for returning users","Hedonism"
"The system must design error states to be less frustrating","Hedonism"
"The application must provide pleasurable ways to explore content","Hedonism"
"The platform must incorporate enjoyable status indicators","Hedonism"
"The system must include elements that make waiting feel shorter","Hedonism"
"The application must provide delightful empty states","Hedonism"
"The platform must incorporate amusing loading messages","Hedonism"
"The system must design tasks to induce flow states","Hedonism"
"The application must include pleasurable ways to review information","Hedonism"
"The platform must provide enjoyable ways to share content","Hedonism"
"The system must seek novel experiences and regularly introduce new features","Stimulation"
"The platform must encourage exploration of unconventional approaches","Stimulation"
"The system must incorporate elements of surprise in user interactions","Stimulation"
"The application must present challenges that test user abilities","Stimulation"
"The platform must introduce varied and unexpected content recommendations","Stimulation"
"The system must encourage experimentation with different approaches","Stimulation"
"The application must include dynamic elements that change with each visit","Stimulation"
"The platform must present intellectual challenges to engage user curiosity","Stimulation"
"The system must incorporate varied difficulty levels to maintain engagement","Stimulation"
"The application must introduce unexpected rewards for user actions","Stimulation"
"The platform must regularly rotate featured content and tools","Stimulation"
"The system must encourage users to try unfamiliar features","Stimulation"
"The application must incorporate novel interaction patterns","Stimulation"
"The platform must prevent monotony through varied visual designs","Stimulation"
"The system must introduce changes to routine processes periodically","Stimulation"
"The application must provide diverse methods to accomplish tasks","Stimulation"
"The platform must incorporate elements of discovery and exploration","Stimulation"
"The system must introduce exciting time-limited challenges","Stimulation"
"The application must use motion and animation to create dynamic experiences","Stimulation"
"The platform must introduce unexpected but beneficial shortcuts","Stimulation"
"The system must encourage switching between different work modes","Stimulation"
"The application must provide novel data visualization methods","Stimulation"
"The platform must incorporate unexpected interactive elements","Stimulation"
"The system must challenge users' assumptions and mental models","Stimulation"
"The application must introduce stimulating competitions and contests","Stimulation"
"The platform must incorporate varied sensory feedback for actions","Stimulation"
"The system must provide adventurous exploration of complex data sets","Stimulation"
"The application must introduce unpredictable but beneficial features","Stimulation"
"The platform must encourage creative thinking through varied challenges","Stimulation"
"The system must incorporate novel categorization systems","Stimulation"
"The application must provide exciting reveals of information","Stimulation"
"The platform must encourage sampling of unfamiliar content types","Stimulation"
"The system must introduce unexpected but relevant connections","Stimulation"
"The application must incorporate occasional surprise animations","Stimulation"
"The platform must provide varied feedback for repeated actions","Stimulation"
"The system must challenge expectations in interface design","Stimulation"
"The application must introduce unusual but effective metaphors","Stimulation"
"The platform must prevent predictability through varied responses","Stimulation"
"The system must provide fresh challenges that increase in complexity","Stimulation"
"The application must incorporate dynamic storytelling elements","Stimulation"
"The platform must encourage cross-disciplinary exploration","Stimulation"
"The system must introduce unexpected perspective shifts","Stimulation"
"The application must provide varied pathways through information","Stimulation"
"The platform must incorporate elements of controlled randomness","Stimulation"
"The system must challenge users with puzzles and brain teasers","Stimulation"
"The application must introduce surprising combinations of existing features","Stimulation"
"The platform must provide varied themed experiences","Stimulation"
"The system must incorporate novel navigation patterns","Stimulation"
"The application must introduce unexpected but relevant information","Stimulation"
"The platform must encourage exploration of unfamiliar subject areas","Stimulation"
"The system must provide varied and engaging onboarding experiences","Stimulation"
"The application must incorporate dynamic content that changes with context","Stimulation"
"The platform must introduce novel problem-solving approaches","Stimulation"
"The system must provide varied sensory experiences","Stimulation"
"The application must incorporate elements of mystery and discovery","Stimulation"
"The platform must encourage breaking conventional usage patterns","Stimulation"
"The system must introduce unexpected productivity enhancements","Stimulation"
"The application must provide diverse aesthetic experiences","Stimulation"
"The platform must incorporate innovative interaction methods","Stimulation"
"The system must challenge users to expand their technical knowledge","Stimulation"
"The application must introduce varied emotional tones in communications","Stimulation"
"The platform must encourage users to create unexpected connections","Stimulation"
"The system must provide novel ways to categorize personal content","Stimulation"
"The application must incorporate regularly changing visual themes","Stimulation"
"The platform must introduce unexpected but beneficial collaborations","Stimulation"
"The system must provide fresh perspectives on familiar problems","Stimulation"
"The application must encourage experimentation with new productivity methods","Stimulation"
"The platform must incorporate discovery mechanisms for hidden features","Stimulation"
"The system must introduce varied approaches to similar problems","Stimulation"
"The platform must maintain environmental sustainability in all operations","Universalism"
"The system must ensure accessibility for users of all abilities without exception","Universalism"
"The application must promote global ethical standards across cultural boundaries","Universalism"
"The platform must transparently share environmental impact metrics","Universalism"
"The system must support humanitarian causes through integrated donation options","Universalism"
"The application must represent diverse cultural perspectives in all content","Universalism"
"The platform must enforce ethical sourcing requirements for all vendors","Universalism"
"The system must provide carbon footprint tracking for all operations","Universalism"
"The application must ensure language inclusivity through comprehensive translations","Universalism"
"The platform must support global conservation initiatives through awareness features","Universalism"
"The system must provide equal access across socioeconomic barriers","Universalism"
"The application must enforce ethical AI guidelines preventing discrimination","Universalism"
"The platform must promote social justice through educational resources","Universalism"
"The system must support biodiversity protection through awareness features","Universalism"
"The application must ensure fair trade practices in all transactions","Universalism"
"The platform must provide climate change impact assessment for user activities","Universalism"
"The system must ensure universal design principles in all interfaces","Universalism"
"The application must promote cross-cultural understanding through diverse content","Universalism"
"The platform must enforce human rights standards in all operations","Universalism"
"The system must provide sustainability ratings for all vendors and partners","Universalism"
"The application must ensure information equity across all regions","Universalism"
"The platform must promote animal welfare through ethical purchasing options","Universalism"
"The system must provide resources for global social issues awareness","Universalism"
"The application must ensure representation of indigenous knowledge systems","Universalism"
"The platform must support global water conservation initiatives","Universalism"
"The system must ensure compatibility with humanitarian aid coordination","Universalism"
"The application must promote peace-building through collaborative features","Universalism"
"The platform must enforce ethical data collection across all cultures","Universalism"
"The system must provide resources on sustainable development goals","Universalism"
"The application must ensure representation of marginalized global perspectives","Universalism"
"The platform must support international human rights monitoring","Universalism"
"The system must provide environmental impact assessments for all features","Universalism"
"The application must ensure ethical representation of all world religions","Universalism"
"The platform must support global pollution reduction initiatives","Universalism"
"The system must enforce fair labor standards across all operations","Universalism"
"The application must promote global educational equity through resources","Universalism"
"The platform must support rainforest conservation awareness","Universalism"
"The system must provide resources for understanding global interdependence","Universalism"
"The application must ensure accurate representation of global health issues","Universalism"
"The platform must support ocean conservation initiatives","Universalism"
"The system must provide tools for reducing global digital divide","Universalism"
"The application must ensure representation of diverse worldviews in content","Universalism"
"The platform must support sustainable agriculture initiatives","Universalism"
"The system must ensure ethical treatment of all demographic data","Universalism"
"The application must promote awareness of international humanitarian law","Universalism"
"The platform must support global poverty reduction initiatives","Universalism"
"The system must ensure consideration of global climate justice","Universalism"
"The application must provide resources on intercultural competence","Universalism"
"The platform must support ethical wildlife conservation efforts","Universalism"
"The system must provide tools for global citizenship education","Universalism"
"The application must ensure ethical representation of global conflicts","Universalism"
"The platform must support sustainable urban development initiatives","Universalism"
"The system must ensure accessibility across global infrastructure variations","Universalism"
"The application must promote responsible consumption patterns","Universalism"
"The platform must support global renewable energy initiatives","Universalism"
"The system must ensure representation of traditional ecological knowledge","Universalism"
"The application must provide tools for global empathy development","Universalism"
"The platform must support ethical treatment of refugees and migrants","Universalism"
"The system must ensure consideration of global future generations","Universalism"
"The application must promote awareness of universal human values","Universalism"
"The system must guarantee fair access to resources for all user demographics","Equality"
"Wage transparency must be maintained across all organizational levels","Equality"
"The interface should accommodate users with disabilities, adhering to WCAG guidelines","Equality"
"The platform must uphold fair hiring practices","Equality"
"Workload should be shared evenly among team members","Equality"
"The algorithm must operate without bias regarding gender, race, or socioeconomic background","Equality"
"All participating stakeholders must have the same voting rights","Equality"
"Users should receive consistent service quality, regardless of subscription level","Equality"
"The reporting feature must highlight pay disparities across departments","Equality"
"Content and imagery should reflect balanced representation","Equality"
"The application must apply rules and policies uniformly to all users","Equality"
"Computing resources should be allocated fairly among all processes","Equality"
"Core features must remain accessible to all users, irrespective of location","Equality"
"The recommendation system should ensure diverse viewpoints on controversial topics","Equality"
"The review process must evaluate submissions using standardized criteria","Equality"
"Speaking time in digital meetings must be distributed fairly","Equality"
"Every participants vote should carry the same weight","Equality"
"Multilingual support must be available to accommodate all languages","Equality"
"Queue processing must follow a fair and impartial order","Equality"
"Rewards must be distributed based on objective criteria","Equality"
"All sellers should have the same level of visibility","Equality"
"Training opportunities must be offered uniformly to all employees","Equality"
"Notifications must be sent to all affected users simultaneously","Equality"
"Discussion participation should not be restricted by seniority","Equality"
"Bandwidth must be allocated fairly among connected devices","Equality"
"Identical services must have consistent pricing across regions","Equality"
"Mentorship and development resources must be accessible to everyone","Equality"
"Task assignments should ensure a balanced level of complexity","Equality"
"New and established content creators should have equal prominence","Equality"
"Marketing materials must maintain a balanced representation","Equality"
"All user demographics should have an equal chance to provide feedback","Equality"
"Maintenance responsibilities should be distributed fairly among team members","Equality"
"Loading times should remain consistent regardless of user location","Equality"
"Support services must be accessible to all subscription tiers","Equality"
"Storage quotas must be allocated equally for users with the same role","Equality"
"Search results should be ranked solely based on relevance","Equality"
"Tax benefits must be distributed according to predefined criteria","Equality"
"Promotions should be merit-based without favoritism","Equality"
"Disciplinary actions must be handled impartially across all positions","Equality"
"Computational load should be evenly distributed among processors","Equality"
"Historical data must be available to all researchers","Equality"
"Risk assessments should apply the same standards across all cases","Equality"
"Proposal submissions must be reviewed with the same level of consideration","Equality"
"Educational resources should be available to all user groups","Equality"
"Community guidelines must be enforced consistently for every user","Equality"
"Networking opportunities must be fairly distributed among participants","Equality"
"All user requests must receive uniform response times","Equality"
"Access to specialized tools should be based on qualifications, not privilege","Equality"
"Stakeholders must be given the same notification period for updates","Equality"
"Minority viewpoints should receive fair visibility in discussions","Equality"
"Interview durations must be the same for all candidates","Equality"
"Beta features should be accessible to all testing groups alike","Equality"
"Skill development opportunities must be available across all roles","Equality"
"Critical tasks must receive consistent processing priority","Equality"
"All negotiation participants must receive identical information","Equality"
"Cooling-off periods for account suspensions must be uniformly enforced","Equality"
"Leadership roles should be open to candidates from all backgrounds equally","Equality"
"Account recovery options should be available for every user type","Equality"
"Background processes must share battery usage fairly","Equality"
"Premium content should be accessible to all users during promotions","Equality"
"Overtime opportunities should be fairly distributed among eligible employees","Equality"
"All evidence must be considered equally in dispute resolution","Equality"
"Decision-making committees should have diverse representation","Equality"
"Rendering quality must be uniform across supported devices","Equality"
"Participation in user research should be equally available to all","Equality"
"Employee wellness programs must be accessible to everyone","Equality"
